{
  "assessment": {
    "assessment_seconds": 704,
    "atomic": 16,
    "extra_after_protected": 16,
    "novel_once": 4,
    "post_trained": 36,
    "pre_old_trained": 0
  },
  "blocks": [
    {
      "block": "trained",
      "expected_count": 36,
      "items": [
        {
          "atom_id": null,
          "intended": {
            "action_index": 2,
            "family": "K",
            "kind": "message",
            "message_id": "K-a2-r4",
            "referent_index": 4,
            "semantic_action": "ALIGN_ARROW",
            "semantic_referent": "B"
          },
          "message_id": "K-a2-r4",
          "pass": 1,
          "plays": 1,
          "position": 1,
          "presentation": null,
          "slot_s": 14,
          "speech_id": null,
          "trained_status": "trained",
          "trial_id": "A-C01-L01-D7-TR-01",
          "trial_type": "trained"
        },
        {
          "atom_id": null,
          "intended": {
            "action_index": 4,
            "family": "K",
            "kind": "message",
            "message_id": "K-a4-r2",
            "referent_index": 2,
            "semantic_action": "ADD_ONE",
            "semantic_referent": "D"
          },
          "message_id": "K-a4-r2",
          "pass": 1,
          "plays": 1,
          "position": 2,
          "presentation": null,
          "slot_s": 14,
          "speech_id": null,
          "trained_status": "trained",
          "trial_id": "A-C01-L01-D7-TR-02",
          "trial_type": "trained"
        },
        {
          "atom_id": null,
          "intended": {
            "action_index": 3,
            "family": "K",
            "kind": "message",
            "message_id": "K-a3-r1",
            "referent_index": 1,
            "semantic_action": "FLIP_CARD",
            "semantic_referent": "A"
          },
          "message_id": "K-a3-r1",
          "pass": 1,
          "plays": 1,
          "position": 3,
          "presentation": null,
          "slot_s": 14,
          "speech_id": null,
          "trained_status": "trained",
          "trial_id": "A-C01-L01-D7-TR-03",
          "trial_type": "trained"
        },
        {
          "atom_id": null,
          "intended": {
            "action_index": 1,
            "family": "Q",
            "kind": "message",
            "message_id": "Q-a1-r1",
            "referent_index": 1,
            "semantic_action": "CLOSE",
            "semantic_referent": "F"
          },
          "message_id": "Q-a1-r1",
          "pass": 1,
          "plays": 1,
          "position": 4,
          "presentation": null,
          "slot_s": 14,
          "speech_id": null,
          "trained_status": "trained",
          "trial_id": "A-C01-L01-D7-TR-04",
          "trial_type": "trained"
        },
        {
          "atom_id": null,
          "intended": {
            "action_index": 1,
            "family": "Q",
            "kind": "message",
            "message_id": "Q-a1-r3",
            "referent_index": 3,
            "semantic_action": "CLOSE",
            "semantic_referent": "H"
          },
          "message_id": "Q-a1-r3",
          "pass": 1,
          "plays": 1,
          "position": 5,
          "presentation": null,
          "slot_s": 14,
          "speech_id": null,
          "trained_status": "trained",
          "trial_id": "A-C01-L01-D7-TR-05",
          "trial_type": "trained"
        },
        {
          "atom_id": null,
          "intended": {
            "action_index": 1,
            "family": "K",
            "kind": "message",
            "message_id": "K-a1-r3",
            "referent_index": 3,
            "semantic_action": "REMOVE_ONE",
            "semantic_referent": "C"
          },
          "message_id": "K-a1-r3",
          "pass": 1,
          "plays": 1,
          "position": 6,
          "presentation": null,
          "slot_s": 14,
          "speech_id": null,
          "trained_status": "trained",
          "trial_id": "A-C01-L01-D7-TR-06",
          "trial_type": "trained"
        },
        {
          "atom_id": null,
          "intended": {
            "action_index": 2,
            "family": "Q",
            "kind": "message",
            "message_id": "Q-a2-r2",
            "referent_index": 2,
            "semantic_action": "QUARANTINE",
            "semantic_referent": "E"
          },
          "message_id": "Q-a2-r2",
          "pass": 1,
          "plays": 1,
          "position": 7,
          "presentation": null,
          "slot_s": 14,
          "speech_id": null,
          "trained_status": "trained",
          "trial_id": "A-C01-L01-D7-TR-07",
          "trial_type": "trained"
        },
        {
          "atom_id": null,
          "intended": {
            "action_index": 1,
            "family": "K",
            "kind": "message",
            "message_id": "K-a1-r1",
            "referent_index": 1,
            "semantic_action": "REMOVE_ONE",
            "semantic_referent": "A"
          },
          "message_id": "K-a1-r1",
          "pass": 1,
          "plays": 1,
          "position": 8,
          "presentation": null,
          "slot_s": 14,
          "speech_id": null,
          "trained_status": "trained",
          "trial_id": "A-C01-L01-D7-TR-08",
          "trial_type": "trained"
        },
        {
          "atom_id": null,
          "intended": {
            "action_index": 3,
            "family": "K",
            "kind": "message",
            "message_id": "K-a3-r4",
            "referent_index": 4,
            "semantic_action": "FLIP_CARD",
            "semantic_referent": "B"
          },
          "message_id": "K-a3-r4",
          "pass": 1,
          "plays": 1,
          "position": 9,
          "presentation": null,
          "slot_s": 14,
          "speech_id": null,
          "trained_status": "trained",
          "trial_id": "A-C01-L01-D7-TR-09",
          "trial_type": "trained"
        },
        {
          "atom_id": null,
          "intended": {
            "action_index": 2,
            "family": "K",
            "kind": "message",
            "message_id": "K-a2-r2",
            "referent_index": 2,
            "semantic_action": "ALIGN_ARROW",
            "semantic_referent": "D"
          },
          "message_id": "K-a2-r2",
          "pass": 1,
          "plays": 1,
          "position": 10,
          "presentation": null,
          "slot_s": 14,
          "speech_id": null,
          "trained_status": "trained",
          "trial_id": "A-C01-L01-D7-TR-10",
          "trial_type": "trained"
        },
        {
          "atom_id": null,
          "intended": {
            "action_index": 2,
            "family": "Q",
            "kind": "message",
            "message_id": "Q-a2-r4",
            "referent_index": 4,
            "semantic_action": "QUARANTINE",
            "semantic_referent": "G"
          },
          "message_id": "Q-a2-r4",
          "pass": 1,
          "plays": 1,
          "position": 11,
          "presentation": null,
          "slot_s": 14,
          "speech_id": null,
          "trained_status": "trained",
          "trial_id": "A-C01-L01-D7-TR-11",
          "trial_type": "trained"
        },
        {
          "atom_id": null,
          "intended": {
            "action_index": 3,
            "family": "Q",
            "kind": "message",
            "message_id": "Q-a3-r3",
            "referent_index": 3,
            "semantic_action": "TAG",
            "semantic_referent": "H"
          },
          "message_id": "Q-a3-r3",
          "pass": 1,
          "plays": 1,
          "position": 12,
          "presentation": null,
          "slot_s": 14,
          "speech_id": null,
          "trained_status": "trained",
          "trial_id": "A-C01-L01-D7-TR-12",
          "trial_type": "trained"
        },
        {
          "atom_id": null,
          "intended": {
            "action_index": 4,
            "family": "Q",
            "kind": "message",
            "message_id": "Q-a4-r2",
            "referent_index": 2,
            "semantic_action": "SCAN",
            "semantic_referent": "E"
          },
          "message_id": "Q-a4-r2",
          "pass": 1,
          "plays": 1,
          "position": 13,
          "presentation": null,
          "slot_s": 14,
          "speech_id": null,
          "trained_status": "trained",
          "trial_id": "A-C01-L01-D7-TR-13",
          "trial_type": "trained"
        },
        {
          "atom_id": null,
          "intended": {
            "action_index": 3,
            "family": "K",
            "kind": "message",
            "message_id": "K-a3-r3",
            "referent_index": 3,
            "semantic_action": "FLIP_CARD",
            "semantic_referent": "C"
          },
          "message_id": "K-a3-r3",
          "pass": 1,
          "plays": 1,
          "position": 14,
          "presentation": null,
          "slot_s": 14,
          "speech_id": null,
          "trained_status": "trained",
          "trial_id": "A-C01-L01-D7-TR-14",
          "trial_type": "trained"
        },
        {
          "atom_id": null,
          "intended": {
            "action_index": 4,
            "family": "K",
            "kind": "message",
            "message_id": "K-a4-r3",
            "referent_index": 3,
            "semantic_action": "ADD_ONE",
            "semantic_referent": "C"
          },
          "message_id": "K-a4-r3",
          "pass": 1,
          "plays": 1,
          "position": 15,
          "presentation": null,
          "slot_s": 14,
          "speech_id": null,
          "trained_status": "trained",
          "trial_id": "A-C01-L01-D7-TR-15",
          "trial_type": "trained"
        },
        {
          "atom_id": null,
          "intended": {
            "action_index": 3,
            "family": "Q",
            "kind": "message",
            "message_id": "Q-a3-r4",
            "referent_index": 4,
            "semantic_action": "TAG",